125	20201105	【河北】正定县桐馨家具厂召回1015型号鞋柜	中国	河北	鞋柜	20	正定县桐馨家具厂按照《消费品召回管理暂行规定》的要求，主动向河北省市场监督管理局报告了召回计划，将自即日起，召回2020年3月至2020年4月期间制造的1015型号鞋柜，涉及数量为20件。 本次召回范围内的1015型号鞋柜，由于在生产过程中与建筑物连接的安装件在使用说明中未明示安装方法,会造成消费者不会安装或安装不当，易造成砸伤等伤害有害物质限量要求——甲醛释放量不达标，长期接触可能引起鼻腔、口腔、咽喉皮肤和消化道癌症，尤其对儿童和孕妇危害也就更大安全要求——结构安全——边缘及尖端项目不符合标准，消费者身体部位与其磕碰可能会造成伤害。对于召回范围内的鞋柜，正定县桐馨家具厂将积极落实企业主体责任，开展缺陷产品召回、安全技术改进工作，提升产品安全生产水平，以消除安全隐患。 正定县桐馨家具厂将自即日起发布召回计划，提示持有受影响产品的消费者停止使用该产品并联系正定县桐馨家具厂或其经销商进行免费更换或退货或通过客户服务热线（0311-88270999），进一步了解具体情况。相关用户可以	黑猫召回	家具及建筑装饰装修材料	未知	https://dpac.samr.gov.cn/xfpzh/xfpgnzh/202011/t20201105_94176.html	砸伤,环境风险	2	物理危害	机械危害	形状和表面性能危害	空	未知	未知	未知	未知		无	否	无	无	无	有	未知	未知	未知	空	空	空	空	空	否	空	无	无	无	无	空	否	否	否	否	否	否	无	无	无	无	无	无	未知	未知	未知	未知	未知	未知	未知	未知	无	无	无	否	无	无	无	无	无	无	无	否	否	否	否	是	未知	未知	未知	否	无	无	无	否	否	有	无	无	无	无	无	无	无	无	无	无	无	无	无	无	无	无	无	无	无	无	无	无	无	无	无	无	无	无	无	无	无	无	无	无	无	无	无	无	无	无	无	无	无	无	无	无	无	无	无	无	无	无	无	无	无	无	无	无	无	无	无	无
126	20201103	【广东】佛山市凌飞电器有限公司召回部分室内加热器	中国	广东	室内加热器	150	佛山市凌飞电器有限公司按照《消费品召回管理暂行规定》的要求，主动向广东省市场监督管理局报告了召回计划，将自即日起，召回2018年10月15日至2018年12月1日期间制造的万宝室内加热器，型号LF-180-D01，涉及数量为150台。 本次召回范围内的室内加热器，由于接地端子无保护接地符号，在电源线损坏更换时，可能造成电源线接错线，造成短路危险产品360度散热，使用时无法保障和易燃物品安全距离，测试角边壁温升超过150K，可能造成火灾的危险。佛山市凌飞电器公司将积极落实企业主体责任，开展缺陷产品召回，为客户进行退货退款，以消除安全隐患。 佛山市凌飞电器公司将自即日起在官方网站和公司微信公众号上发布召回计划，提示持有受影响产品的消费者停止使用该产品并联系佛山市凌飞电器公司或其经销商进行退货退款。	黑猫召回	家用电器及电器附件	未知	https://dpac.samr.gov.cn/xfpzh/xfpgnzh/202011/t20201103_94143.html	烧伤,电击伤	2	物理危害	高/低温物质危害,电气危害	高温物质危害,触电危害	空	未知	未知	未知	未知		无	否	无	无	无	无	未知	未知	未知	空	空	空	空	空	否	空	无	无	无	无	空	否	否	否	否	否	否	无	无	无	无	无	无	是	未知	未知	未知	是	未知	未知	未知	无	无	无	否	无	无	无	无	无	无	无	否	否	否	否	是	未知	未知	未知	否	无	无	无	否	否	无	无	无	无	无	无	无	无	无	无	无	无	无	无	无	无	无	无	无	无	无	无	无	无	无	无	无	无	无	无	无	无	无	无	无	无	无	无	无	无	无	无	无	无	无	无	无	无	无	无	无	无	无	无	无	无	无	无	无	无	无	无	无
127	20201103	【广东】佛山市南海德玲电器有限公司召回部分豪华型取暖炉	中国	广东	豪华型取暖炉	3500	佛山市南海德玲电器有限公司按照《消费品召回管理暂行规定》的要求，主动向广东省市场监督管理局报告了召回计划，将自即日起召回2015年1月至2015年8月期间制造的部分钻石皇中王品牌豪华型取暖炉，型号NH-80A，涉及数量为3500件。 本次召回范围内的取暖炉，由于产品的安全使用说明不足、对触及带电部件的防护、非正常工作、结构、接地措施方面不符合安全标准要求，可能会产生电击触电和引起火灾危险，存在危及人身、财产安全的不合理风险。对于召回范围内的取暖炉，佛山市南海德玲电器有限公司将积极落实企业主体责任，开展缺陷产品召回、安全技术改进工作，提升产品安全水平，并免费为客户更换一件全新的符合要求的取暖炉或者退货处理，以消除安全隐患。 佛山市南海德玲电器有限公司将自即日起在经销商门店发布召回计划，提示持有受影响产品的消费者停止使用该产品并联系佛山市南海德玲电器有限公司或其经销商进行免费更换或者退货。 	黑猫召回	家用电器及电器附件	未知	https://dpac.samr.gov.cn/xfpzh/xfpgnzh/202011/t20201103_94142.html	烧伤,电击伤	2	物理危害	高/低温物质危害,电气危害	高温物质危害,触电危害	空	未知	未知	未知	未知		无	否	无	无	无	无	未知	未知	未知	空	空	空	空	空	否	空	无	无	无	无	空	否	否	否	否	否	否	无	无	无	无	无	无	是	未知	未知	是	未知	未知	未知	未知	无	无	无	否	无	无	无	无	无	无	无	否	否	否	否	是	未知	未知	未知	否	无	无	无	否	否	无	无	无	无	无	无	无	无	无	无	无	无	无	无	无	无	无	无	无	无	无	无	无	无	无	无	无	无	无	无	无	无	无	无	无	无	无	无	无	无	无	无	无	无	无	无	无	无	无	无	无	无	无	无	无	无	无	无	无	无	无	无	无
128	20201103	【广东】广东俊朗松田电器有限公司召回部分的USB插座	中国	广东	充电器	1	广东俊朗松田电器有限公司按照《消费品召回管理暂行规定》的要求，主动向广东省市场监督管理局报告了召回计划，将自即日起，召回2019年8月16日至8月19日期间制造的JUNON品牌USB插座，型号为P9PK/USB2/D，批次号标志为LJKSR，涉及产品数量1800件。 本次召回范围内的USB插座，由于电气间隙、爬电距离、绝缘穿透距离等方面不符合安全标准要求，产品存在极限使用时过热，损坏充电器或触电的隐患。对于召回范围内的USB插座，广东俊朗松田电器公司将积极落实企业主体责任，开展缺陷产品召回、安全技术改进工作，提升产品安全水平，并免费为客户更换一件全新的符合要求的USB插座，以消除安全隐患。 广东俊朗松田电器公司将自即日起在官方网站上发布召回计划，提示持有受影响产品的消费者停止使用该产品并联系广东俊朗松田电器公司或其经销商进行免费更换。	黑猫召回	家用电器及电器附件	未知	https://dpac.samr.gov.cn/xfpzh/xfpgnzh/202011/t20201103_94141.html	烫伤,电击伤	2	物理危害	电气危害	触电危害	空	未知	未知	未知	未知		无	否	无	无	无	无	未知	未知	未知	空	空	空	空	空	否	空	无	无	无	无	空	否	否	否	否	否	否	无	无	无	无	无	无	未知	未知	是	是	未知	未知	未知	未知	无	无	无	否	无	无	无	无	无	无	无	否	否	否	否	是	未知	未知	未知	否	无	无	无	否	否	无	无	无	无	无	无	无	无	无	无	无	无	无	无	无	无	无	无	无	无	无	无	无	无	无	无	无	无	无	无	无	无	无	无	无	无	无	无	无	无	无	无	无	无	无	无	无	无	无	无	无	无	无	无	无	无	无	无	无	无	无	无	无
129	20201103	【广东】佛山市顺德区奥德尔实业有限公司召回部分电暖器	中国	广东	电暖器	120	佛山市顺德区奥德尔实业有限公司按照《消费品召回管理暂行规定》的要求，主动向广东省市场监督管理局报告了召回计划，将自即日起，召回2019年09月28日生产的奥德尔电暖器，型号HF-C1A(K)，涉及数量为120台。 本次召回范围内的电暖器，由于缺少接地标志和在生产过程中混入未经特殊处理的反射罩，可能存在过热起火的安全隐患。对于召回范围内的电暖器，佛山市顺德区奥德尔实业有限公司将积极落实企业主体责任，开展缺陷产品召回、安全技术改进工作，提升产品安全水平，并免费为客户补充警示标识，更换合格配件或置换符合要求的电暖器产品，以消除安全隐患。 佛山市顺德区奥德尔实业有限公司将自即日起在公司官方网站上发布召回计划，提示持有受影响产品的消费者停止使用该产品并联系佛山市顺德区奥德尔实业有限公司或其销售商进行召回。	黑猫召回	家用电器及电器附件	未知	https://dpac.samr.gov.cn/xfpzh/xfpgnzh/202011/t20201103_94140.html	烧伤,烫伤	2	物理危害	高/低温物质危害,电气危害	高温物质危害,触电危害	空	未知	未知	未知	未知		无	否	无	无	无	无	未知	未知	未知	空	空	空	空	空	否	空	无	无	无	无	空	否	否	否	否	否	否	无	无	无	无	无	无	是	未知	是	未知	未知	未知	未知	未知	无	无	无	否	无	无	无	无	无	无	无	否	否	否	否	是	未知	未知	未知	否	无	无	无	否	否	无	无	无	无	无	无	无	无	无	无	无	无	无	无	无	无	无	无	无	无	无	无	无	无	无	无	无	无	无	无	无	无	无	无	无	无	无	无	无	无	无	无	无	无	无	无	无	无	无	无	无	无	无	无	无	无	无	无	无	无	无	无	无
130	20201027	【安徽】安徽品客食品有限公司召回部分航空杯	中国	安徽	航空杯	180	安徽品客食品有限公司按照《消费品召回管理暂行规定》的要求，主动向安徽省市场监督管理局、合肥市市场监督管理局报告了召回计划，将自即日起，召回2020年5月28日生产销售的200ml PP航空杯，涉及数量为180包。 本次召回范围内的航空杯，由于在生产过程中杯底偏软，可能存在泄露食物或造成烫伤的安全隐患。对于召回范围内的航空杯，安徽品客食品有限公司将积极落实企业主体责任，开展缺陷产品召回、安全技术改进工作，提升产品安全水平，并免费为客户更换相应的合格产品，以消除安全隐患。 安徽品客食品有限公司将自即日起发布召回计划，提示持有受影响产品的消费者停止使用该产品并联系安徽品客食品有限公司或其经销商进行免费更换。 	黑猫召回	日用杂品	未知	https://dpac.samr.gov.cn/xfpzh/xfpgnzh/202010/t20201027_94023.html	烫伤	2	物理危害	高/低温物质危害	高温物质危害	空	未知	未知	未知	未知	空	无	否	无	无	无	无	未知	未知	未知	空	空	空	空	空	否	空	无	无	无	无	空	否	否	否	否	否	否	有	无	无	无	无	无	未知	未知	未知	未知	未知	未知	未知	未知	无	无	无	否	无	无	无	无	无	无	无	否	否	否	否	是	未知	未知	未知	否	无	无	无	否	否	无	无	无	无	无	无	无	无	无	无	无	无	无	无	无	无	无	无	无	无	无	无	无	无	无	无	无	无	无	无	无	无	无	无	无	无	无	无	无	无	无	无	无	无	无	无	无	无	无	无	无	无	无	无	无	无	无	无	无	无	无	无	无
131	20201027	【安徽】巢湖百乐塑胶制品厂召回部分航空杯	中国	安徽	航空杯	80	巢湖百乐塑胶制品厂按照《消费品召回管理暂行规定》的要求，主动向安徽省市场监督管理局、合肥市市场监督管理局报告了召回计划，自即日起，召回2020年5月10日至2020年5月12日期间制造的型号为230ml*50支/袋的飞凡牌航空杯，涉及数量为80袋。 本次召回范围内的航空杯，由于在生产过程中塑料加工工艺不达标，可能造成食物泄露，若装送高温食品时，极易造成烫伤的安全隐患。对于召回范围内的航空杯，巢湖市百乐塑胶制品厂将积极落实企业主体责任，开展缺陷产品召回和安全技术改进工作，提升产品安全水平，并免费为客户更换同等数量符合要求的航空杯，以消除安全隐患。 巢湖市百乐塑胶制品厂已在厂区、经销商处发布召回计划，提示持有受影响产品的消费者停止使用该产品并联系巢湖市百乐塑胶制品厂或其经销商进行免费更换。 	黑猫召回	日用杂品	未知	https://dpac.samr.gov.cn/xfpzh/xfpgnzh/202010/t20201027_94022.html	烫伤	2	物理危害	高/低温物质危害	高温物质危害	空	未知	未知	未知	未知	230ml	无	否	无	无	无	无	未知	未知	未知	空	空	空	空	空	否	空	无	无	无	无	空	否	否	否	否	否	否	有	无	无	无	无	无	未知	未知	未知	未知	未知	未知	未知	未知	无	无	无	否	无	无	无	无	无	无	无	否	否	否	否	是	未知	未知	未知	否	无	无	无	否	否	无	无	无	无	无	无	无	无	无	无	无	无	无	无	无	无	无	无	无	无	无	无	无	无	无	无	无	无	无	无	无	无	无	无	无	无	无	无	无	无	无	无	无	无	无	无	无	无	无	无	无	无	无	无	无	无	无	无	无	无	无	无	无
132	20201022	【广东】深圳市美致科技有限公司召回部分智能插座/转换器	中国	广东	智能插座/转换器	1200	深圳市美致科技有限公司按照《消费品召回管理暂行规定》的要求，主动向广东省市场监督管理局报告了召回计划，将自即日起，召回2019年12月至2020年1月期间制造的部分汉楚品牌智能插座/转换器，型号YD，涉及数量为1200件。 本次召回范围内的智能插座/转换器，由于在电气间隙、爬电距离和绝缘穿透距离方面不符合安全标准要求，可能会产生电击触电危险，存在危及人身、财产安全的不合理风险。对于召回范围内的智能插座/转换器，深圳市美致科技有限公司将积极落实企业主体责任，开展缺陷产品召回、安全技术改进工作，提升产品安全水平，并免费为客户置换或者退货服务，以消除安全隐患。 深圳市美致科技有限公司将自即日起在天猫店铺汉楚旗舰店上发布召回计划，提示持有受影响产品的消费者停止使用该产品并联系深圳市美致科技有限公司或其经销商进行置换或者退货处理。	黑猫召回	家用电器及电器附件	未知	https://dpac.samr.gov.cn/xfpzh/xfpgnzh/202010/t20201022_93941.html	电击伤	2	物理危害	电气危害	触电危害	空	未知	未知	未知	未知		无	否	无	无	无	无	未知	未知	未知	空	空	空	空	空	否	空	无	无	无	无	空	否	否	否	否	否	否	无	无	无	无	无	无	未知	未知	未知	是	未知	未知	未知	未知	无	无	无	否	无	无	无	无	无	无	无	否	否	否	否	是	未知	未知	未知	否	无	无	无	否	否	无	无	无	无	无	无	无	无	无	无	无	无	无	无	无	无	无	无	无	无	无	无	无	无	无	无	无	无	无	无	无	无	无	无	无	无	无	无	无	无	无	无	无	无	无	无	无	无	无	无	无	无	无	无	无	无	无	无	无	无	无	无	无
133	20201020	【安徽】天长市康来电子厂召回部分众非凡充电器	中国	安徽	充电器	400	天长市康来电子厂按照《消费品召回管理暂行规定》的要求，主动向安徽省市场监督管理局、滁州市市场监督管理局报告了召回计划，将自即日起，召回2020年8月14日生产的型号为众非凡60V20Ah铅酸电池充电器，数量为400只。 本次召回的产品存在的问题是众非凡充电器没有按照T/TCDZ0001-2019《电动自行车用蓄电池充电器》标准要求，存在泄漏电流和电气强度的问题，对消费者使用存在安全隐患。对于召回范围内的充电器，天长市康来电子厂将积极落实企业主体责任，开展缺陷产品召回、安全技术改进工作，提升产品安全水平。天长市康来电子厂提示购买众非凡60V20Ah铅酸电池充电器的消费者立即停止使用，公司将为购买上述产品的消费者提供退换货或退款服务。 	黑猫召回	家用电器及电器附件	未知	https://dpac.samr.gov.cn/xfpzh/xfpgnzh/202010/t20201020_93900.html	电击伤	2	物理危害	电气危害	触电危害	空	未知	未知	未知	未知		无	否	无	无	无	无	未知	未知	电池	空	空	空	空	空	否	空	无	无	无	无	空	否	否	否	否	否	否	无	无	无	无	无	无	未知	未知	未知	是	未知	未知	未知	未知	无	无	无	否	无	无	无	无	无	无	无	否	否	否	否	是	未知	未知	未知	否	无	无	无	否	否	无	无	无	无	无	无	无	无	无	无	无	无	无	无	无	无	无	无	无	无	无	无	无	无	无	无	无	无	无	有	无	无	无	无	无	无	无	无	无	无	无	无	无	无	无	无	无	无	无	无	无	无	无	无	无	无	无	无	无	无	无	无	无
134	20201020	【安徽】天长市文宇电子有限公司召回部分锂离子电池	中国	安徽	锂离子电池	500	天长市文宇电子有限公司按照《消费品召回管理暂行规定》的要求，主动向安徽省市场监督管理局、滁州市市场监督管理局报告了召回计划，将自即日起，召回2020年7月至8月期间制造的部分60V20Ah型号锂离子电池，涉及数量为500只。 本次召回范围内的锂离子电池，由于在生产过程中混入多余物，可能存在过热起火的安全隐患。对于召回范围内的锂离子电池，天长市文宇电子有限公司将积极落实企业主体责任，开展缺陷产品召回、安全技术改进工作，提升产品安全水平，并免费为客户更换一件全新的符合要求的锂离子电池，以消除安全隐患。 天长市文宇电子有限公司将自即日起发布召回计划，提示持有受影响产品的消费者停止使用该产品并联系公司或其经销商进行免费更换。	黑猫召回	家用电器及电器附件	未知	https://dpac.samr.gov.cn/xfpzh/xfpgnzh/202010/t20201020_93899.html	烧伤,烫伤	2	物理危害	高/低温物质危害,电气危害	高温物质危害,触电危害	空	未知	未知	未知	未知		无	否	无	无	无	无	未知	未知	锂离子电池,电池	空	空	空	空	空	否	空	无	无	无	无	空	否	否	否	否	否	否	无	无	无	无	无	无	是	未知	是	未知	未知	未知	未知	未知	无	无	无	否	无	无	无	无	无	无	无	否	否	否	否	是	未知	未知	未知	否	无	无	无	否	否	无	无	无	无	无	无	无	无	无	无	无	无	无	无	无	无	无	无	无	无	无	无	无	无	无	无	无	无	无	无	无	无	无	无	无	无	无	无	无	无	无	无	无	无	无	无	无	无	无	无	无	无	无	无	无	无	无	无	无	无	无	无	无
135	20201019	【广东】深圳市奇胜电器照明有限公司召回部分五孔带2位USB插座	中国	广东	USB插座	521	深圳市奇胜电器照明有限公司按照《消费品召回管理暂行规定》的要求，主动向广东省市场监督管理局报告了召回计划，将自即日起，召回2019年4月至2020年8月期间制造的HKQSDQ品牌K8型号五孔带2位USB插座，涉及数量为521件。 本次召回范围内的五孔带2位USB插座在电气绝缘、电气间隙、爬电距离和绝缘穿透距离、抗电强度等方面不符合安全标准要求，可能会产生电击触电危险，存在危及人身、财产安全的不合理风险。对于召回范围内的五孔带2位USB插座，深圳市奇胜电器照明有限公司将积极落实企业主体责任，开展缺陷产品召回、安全技术改进工作，提升产品安全水平，并为客户提供置换或者退货服务，以消除安全隐患。 深圳市奇胜电器照明有限公司将自即日起在京东SZSONBEM旗舰店上发布召回计划，提示持有受影响产品的消费者停止使用该产品并联系深圳市奇胜电器照明有限公司或其经销商进行置换或者退货处理。	黑猫召回	家用电器及电器附件	未知	https://dpac.samr.gov.cn/xfpzh/xfpgnzh/202010/t20201019_93837.html	电击伤	2	物理危害	电气危害	触电危害	空	未知	未知	未知	未知		无	否	无	无	无	无	未知	未知	未知	空	空	空	空	空	否	空	无	无	无	无	空	否	否	否	否	否	否	无	无	无	无	无	无	未知	未知	未知	是	未知	未知	未知	未知	无	无	无	否	无	无	无	无	无	无	无	否	否	否	否	是	未知	未知	未知	否	无	无	无	否	否	无	无	无	无	无	无	无	无	无	无	无	无	无	无	无	无	无	无	无	无	无	无	无	无	无	无	无	无	无	无	无	无	无	无	无	无	无	无	无	无	无	无	无	无	无	无	无	无	无	无	无	无	无	无	无	无	无	无	无	无	无	无	无
136	20201020	【广西】南宁市欧亚辉源餐饮用品有限公司召回部分航空杯	中国	广西	航空杯	8000	 南宁市欧亚辉源餐饮用品有限公司按照《消费品召回管理暂行规定》的要求，主动向广西壮族自治区市场监督管理局报告了召回计划，将自即日起，召回2019年11月18日生产的品牌为品丽的航空杯，涉及数量为8000袋（50个/袋）。 本次召回范围内的航空杯，由于在盛装了一定量的液体之后会出现较大变形甚至倒塌，难以拿捏住，若盛装热水容易造成烫伤等危险情形，存在安全隐患。对于召回范围内的航空杯，南宁市欧亚辉源餐饮用品有限公司将积极落实企业主体责任，开展缺陷产品召回、安全技术改进工作，提升产品安全水平，并为客户免费退换货，以消除安全隐患。 南宁市欧亚辉源餐饮用品有限公司已经在其微信客户群及销售终端门店发布召回公告，提示持有受影响产品的消费者停止使用该产品并联系南宁市欧亚辉源餐饮用品有限公司或其经销商进行免费退换货，	黑猫召回	日用杂品	未知	https://dpac.samr.gov.cn/xfpzh/xfpgnzh/202010/t20201020_93896.html	烫伤	2	物理危害	高/低温物质危害	高温物质危害	空	未知	未知	未知	未知	空	无	否	无	无	无	无	未知	未知	未知	空	空	空	空	空	否	空	无	无	无	无	空	否	否	否	否	否	否	有	无	无	无	无	无	未知	未知	未知	未知	未知	未知	未知	未知	无	无	无	否	无	无	无	无	无	无	无	否	否	否	否	是	未知	未知	未知	否	无	无	无	否	否	无	无	无	无	无	无	无	无	无	无	无	无	无	无	无	无	无	无	无	无	无	无	无	无	无	无	无	无	无	无	无	无	无	无	无	无	无	无	无	无	无	无	无	无	无	无	无	无	无	无	无	无	无	无	无	无	无	无	无	无	无	无	无
137	20201013	【广东】普宁市驰伟电子科技有限公司召回部分智能安全插座	中国	广东	智能安全插座	5000	普宁市驰伟电子科技有限公司按照《消费品召回管理暂行规定》的要求，主动向广东省市场监督管理局报告了召回计划，将自即日起，召回2019年1月至2020年9月期间制造的部分驰伟品牌智能安全插座，型号W8054，涉及数量为5000件。 本次召回范围内的智能安全插座，由于在电气间隙、爬电距离、绝缘穿透距离以及发热要求等方面不符合安全标准要求，可能会产生电击触电危险和引起火灾危险，存在危及人身、财产安全的不合理风险。对于召回范围内的智能安全插座，普宁市驰伟电子科技有限公司将积极落实企业主体责任，开展缺陷产品召回、安全技术改进工作，提升产品安全水平，并免费为客户提供置换或者退货服务，以消除安全隐患。 普宁市驰伟电子科技有限公司将自即日起在驰伟天猫旗舰店上发布召回计划，提示持有受影响产品的消费者停止使用该产品并联系普宁市驰伟电子科技有限公司或其经销商进行置换或者退货处理。	黑猫召回	家用电器及电器附件	未知	https://dpac.samr.gov.cn/xfpzh/xfpgnzh/202010/t20201013_93627.html	烧伤,电击伤	2	物理危害	高/低温物质危害,电气危害	高温物质危害,触电危害	空	未知	未知	未知	未知		无	否	无	无	无	无	未知	未知	未知	空	空	空	空	空	否	空	无	无	无	无	空	否	否	否	否	否	否	无	无	无	无	无	无	是	未知	未知	是	未知	未知	未知	未知	无	无	无	否	无	无	无	无	无	无	无	否	否	否	否	是	未知	未知	未知	否	无	无	无	否	否	无	无	无	无	无	无	无	无	无	无	无	无	无	无	无	无	无	无	无	无	无	无	无	无	无	无	无	无	无	无	无	无	无	无	无	无	无	无	无	无	无	无	无	无	无	无	无	无	无	无	无	无	无	无	无	无	无	无	无	无	无	无	无
