64	20210402	永康市瑾玺电子科技有限公司召回部分儿童平衡车	中国	不详	儿童平衡车	1	  永康市瑾玺电子科技有限公司按照《消费品召回管理暂行规定》的要求，向国家市场监督管理总局报告了召回计划，将自即日起，召回2020年1月至2020年9月期间制造的部分飞鸽牌AL-1209/AL1409型儿童平衡车，涉及数量为22100辆。  本次召回范围内的飞鸽牌儿童平衡车，由于座杆过长、儿童可触及部位存在锐利边缘，以及安全警识标志缺失等不合理危险，可能导致摔车、划伤及消费者误用、滥用等安全风险，在复杂路况及骑行速度过快等极端情况下，可能无法及时有效制动，给儿童带来不可预见的伤害。对于召回范围内的儿童平衡车，永康市瑾玺电子科技有限公司将积极落实企业主体责任，开展缺陷产品召回、安全技术改进工作，提升产品安全水平，为消费者提供座杆调节工具和座杆堵件，在产品上增加安全警示标志，以降低安全风险。  永康市瑾玺电子科技有限公司将自即日起在官方网站（www.ander.cn）上发布召回计划，提示持有受影响产品的消费者联系永康市瑾玺电子科技有限公司或其经销商索取座杆调节工具、座杆堵件及安全警示标志。	黑猫召回	儿童用品	童车	https://dpac.samr.gov.cn/xfpzh/xfpgnzh/202104/t20210402_97039.html	擦伤,其他	2	物理危害	机械危害	形状和表面性能危害	空	未知	未知	未知	未知	空	无	否	无	有	无	无	未知	未知	未知	空	空	空	空	空	否	空	无	无	无	无	空	否	否	否	否	否	否	无	无	无	无	无	无	未知	未知	未知	未知	未知	未知	未知	未知	无	无	无	否	无	无	无	无	无	无	无	否	否	否	否	是	未知	未知	未知	否	无	无	无	否	否	无	无	无	无	无	无	无	无	无	无	无	无	无	无	无	无	无	无	无	无	无	无	无	无	无	无	无	无	无	无	无	无	无	无	无	无	无	无	无	无	无	无	无	无	无	无	无	无	无	无	无	无	无	无	无	无	无	无	无	无	无	无	无
65	20210318	【北京】北京绿色安全农产品物流信息中心有限公司主动召回部分型号纸碗	中国	北京	纸碗	400	北京绿色安全农产品物流信息中心有限公司按照《消费品召回管理暂行规定》的要求，向北京市市场监督管理局报告了召回计划，主动召回2020年3月16日制造的本色纸碗（规格型号350mL，φ135mm×H45.6mm，10只/包），涉及数量为400包。 本次召回范围内的纸碗，由于在制造过程中使用了不合格的原材料，导致抗压性能项目不符合GB/T 36787-2018标准要求，在使用过程中易变形，如果盛装温度高的食品，存在烫伤使用者的风险。对于召回范围内的纸碗，北京绿色安全农产品物流信息中心有限公司将积极落实企业主体责任，开展缺陷产品召回及产品报废处理等工作，并将在以后的工作中加强原材料检验力度，提升产品质量安全水平，消除安全隐患。 北京绿色安全农产品物流信息中心有限公司将自即日起在销售门店发布召回公告，同时结合电话通知等方式提示持有该批次产品的消费者采取避免放置过重、过热物品或者立即停止使用等应急措施，并联系经销商进行免费退货。 	黑猫召回	日用杂品	未知	https://dpac.samr.gov.cn/xfpzh/xfpgnzh/202103/t20210318_96779.html	烫伤	2	物理危害	高/低温物质危害,电气危害	高温物质危害,触电危害	空	未知	未知	未知	未知	型号350m	无	否	无	无	无	无	未知	未知	未知	空	空	空	空	空	否	空	无	无	无	无	空	否	否	否	否	否	否	有	无	无	无	无	无	未知	未知	是	未知	未知	未知	未知	未知	无	无	无	否	无	无	无	无	无	无	无	否	否	否	否	是	未知	未知	未知	否	无	无	无	否	否	无	无	无	无	无	无	无	无	无	无	无	无	无	无	无	无	无	无	无	无	无	无	无	无	无	无	无	无	无	无	无	无	无	无	无	无	无	无	无	无	无	无	无	无	无	无	无	无	无	无	无	无	无	无	无	无	无	无	无	无	无	无	无
66	20210312	四川鸿昌塑胶工业有限公司召回部分洗刷刷平板拖把（智尊版）	中国	四川	洗刷刷平板拖把（智尊版）	10000	 四川鸿昌塑胶工业有限公司按照《消费品召回管理暂行规定》的要求，向国家市场监督管理总局报告了召回计划，将自即日起，召回2020年1月21日到12月31日期间制造的部分美丽雅牌HC073067型洗刷刷平板拖把（智尊版），涉及数量为10000件。  本次召回范围内的洗刷刷平板拖把，把杆薄壁管件存在锐利边缘，由于其拖把杆工艺管控问题，在消费者使用过程中，拖把把杆可能会出现破裂，存在划伤人体的安全隐患。对于召回范围内的洗刷刷平板拖把，四川鸿昌塑胶工业有限公司将积极落实企业主体责任，开展缺陷产品召回、安全技术改进工作，提升产品安全水平，并免费为客户更换一套安全的拖把杆，以消除安全隐患。  四川鸿昌塑胶工业有限公司将自即日起在官方网站（WWW.MARYYA.COM）上发布召回计划，提示持有受影响产品的消费者停止使用该产品并联系四川鸿昌塑胶工业有限公司进行免费更换。	黑猫召回	日用杂品	未知	https://dpac.samr.gov.cn/xfpzh/xfpgnzh/202103/t20210312_96689.html	擦伤	1	物理危害	机械危害	形状和表面性能危害	空	未知	未知	未知	未知	空	无	否	无	有	无	无	未知	未知	未知	空	空	空	空	空	否	空	无	无	无	无	空	否	否	否	否	否	否	无	无	无	无	无	无	未知	未知	未知	未知	未知	未知	未知	未知	无	无	无	否	无	无	无	无	无	无	无	否	否	否	否	是	未知	未知	未知	否	无	无	无	否	否	无	无	无	无	无	无	无	无	无	无	无	无	无	无	无	无	无	无	无	无	无	无	无	无	无	无	无	无	无	无	无	无	无	无	无	无	无	无	无	无	无	无	无	无	无	无	无	无	无	无	无	无	无	无	无	无	无	无	无	无	无	无	无
67	20210309	【上海】上海爱囡囡信息科技有限公司召回部分家用童床	中国	上海	家用童床	1	 生产者名称 上海爱囡囡信息科技有限公司 产品名称 家用童床（婴儿床） 品牌 Picci 型号/规格 Marlin 生产起止日期 2019年3月1日-2019年5月30日 涉及数量 31件 生产批号/批次 20193797 产品描述及外观照片 白色家用童床（婴儿床）  存在的缺陷 1.床铺面结构要求不符合标准规定，相邻两根板条之间的间隙过大 2.缺少警示标志使用说明书中缺少床铺面最低位置是最安全的说明，缺少 遗留物品可能引起危险的说明，缺少床垫厚度选择的说明。 可能导致的后果 1.婴儿在未铺床垫的此款婴儿床上，可能会导致肢体卡入缝隙 2.未张贴警示标志，可能会造成童床误用、误装，存在引起婴儿窒息、跌落 等伤害的风险。 避免损害发生的应急处置方式 告知消费者请勿在未铺床垫的情况下使用婴儿床邮寄中文说明书给顾客， 告知消费者可能存在的安全隐患。 具体召回措施 1.告知消费者请勿在未铺床垫的情况下使用婴儿床邮寄中文说明书给顾 客，告知消费者可能存在的安全隐患 2.根据消费者意愿，可以免费更换婴儿床床底板。 召回负责机构 上海爱囡囡信息科技有限公司 召回联系方式 在Picci天猫旗舰店发布召回计划告知消费者，联系电话18930586057。 召回进度安排 2021年3月5日开始召回，计划完成时间2021年6月4日。 其他需要报告的内容 暂无 其他信息 相关用户可以登录缺陷产品管理中心网站（dpac.samr..cn）以及关注微信 公众号（SAMRDPAC)，或登录上海市市场监督管理局网站(scjgj.sh..cn)， 也可以拨打热线电话010-59799616，021-54266039反映更多缺陷信息。 （转自上海市市场监督管理局网站） 	黑猫召回	儿童用品	儿童家具	https://dpac.samr.gov.cn/xfpzh/xfpgnzh/202103/t20210309_96615.html	窒息	3	物理危害	警示标识缺失	警示标识缺失	空	未知	未知	未知	未知		无	否	无	无	无	无	未知	未知	未知	空	空	空	空	空	否	空	无	无	无	无	空	否	否	否	否	否		无	无	无	无	无	无	未知	未知	未知	未知	未知	未知	未知	未知	无	无	无	否	无	无	无	无	无	无	无	否	否	否	否	是	未知	未知	未知	否	无	无	无	否	否	无	无	无	无	无	无	无	无	无	无	无	无	无	无	无	无	无	无	无	无	无	无	无	无	无	无	无	无	无	无	无	无	无	无	无	无	无	无	无	无	无	无	无	无	无	无	无	无	无	无	无	无	无	无	无	无	无	无	无	无	无	无	无
68	20210223	【广东】深圳市倍斯特科技股份有限公司召回部分移动电源	中国	广东	移动电源	21	深圳市倍斯特科技股份有限公司按照《消费品召回管理暂行规定》的要求，主动向广东省市场监督管理局报告了召回计划，将自即日起，召回2018年1月期间制造的Besiter品牌移动电源，型号BST-0141，涉及数量为21件。 本次召回范围内的移动电源，由于未严格按照“应力消除”的标准进行检测，存在可能因塑料外壳变形或收缩，进而挤压内部器件发生短路起火的安全隐患。对于召回范围内的移动电源，深圳市倍斯特科技股份有限公司将积极落实企业主体责任，开展缺陷产品召回、安全技术改进工作，提升产品安全水平，并为客户进行退货处理，以消除安全隐患。 深圳市倍斯特科技股份有限公司将自2021年2月19日起在公司微信公众号（Besiter_powerbank）上发布召回计划，提示持有受影响产品的消费者停止使用该产品并联系深圳市倍斯特科技股份有限公司进行退货。	黑猫召回	家用电器及电器附件	未知	https://dpac.samr.gov.cn/xfpzh/xfpgnzh/202102/t20210223_96260.html	挤压伤,烧伤,电击伤	2	物理危害	高/低温物质危害,电气危害	高温物质危害,触电危害	空	未知	未知	未知	未知		无	否	无	无	无	无	未知	未知	未知	空	空	空	空	空	否	空	无	无	无	无	空	否	否	否	否	否	否	无	无	无	无	无	无	是	未知	未知	未知	是	未知	未知	未知	无	无	无	否	无	无	无	无	无	无	无	否	否	否	否	是	未知	未知	未知	否	无	无	无	否	否	无	无	无	无	无	无	无	无	无	无	无	无	无	无	无	无	无	无	无	无	无	无	无	无	无	无	无	无	无	无	无	无	无	无	无	无	无	无	无	无	无	无	无	无	无	无	无	无	无	无	无	无	无	无	无	无	无	无	无	无	无	无	无
69	20210220	【安徽】安徽酷米智能科技股份有限公司召回GSM数字移动电话手机	中国	安徽	GSM数字移动电话手机	264	安徽酷米智能科技股份有限公司按照《消费品召回管理暂行规定》的要求，主动向安徽省市场监督管理局、宿松县市场监督管理局备案了召回计划，决定自即日起对2020年2月16日生产的型号S11，规格S11的GSM数字移动电话手机产品实施召回，涉及数量为264台。 本次召回产品存在的主要问题是电气绝缘、电气间隙和爬电距离、耐异常热和抗电强度均不符合相关标准要求，存在电击、起火、爆裂的风险，对人身财产安全产生隐患。安徽酷米智能科技股份有限公司将积极落实企业主体责任，开展缺陷产品召回、安全技术改进工作，提升产品安全水平，并免费为客户更换合格产品，以消除安全隐患。 	黑猫召回	信息技术产品	未知	https://dpac.samr.gov.cn/xfpzh/xfpgnzh/202102/t20210220_96227.html	烧伤	2	物理危害	高/低温物质危害	高温物质危害	空	未知	未知	未知	未知		无	否	无	无	无	无	未知	未知	未知	空	空	空	空	空	否	空	无	无	无	无	空	否	否	否	否	否	否	无	无	无	无	无	无	是	未知	未知	未知	未知	未知	未知	未知	无	无	无	否	无	无	无	无	无	无	无	否	否	否	否	是	未知	未知	未知	否	无	无	无	否	否	无	无	无	无	无	无	无	无	无	无	无	无	无	无	无	无	无	无	无	无	无	无	无	无	无	无	无	无	无	无	无	无	无	无	无	无	无	无	无	无	无	无	无	无	无	无	无	无	无	无	无	无	无	无	无	无	无	无	无	无	无	无	无
70	20210218	【广东】深圳市家中牛电气有限公司召回部分多功能转换器插座	中国	广东	多功能转换器插座	1071	深圳市家中牛电气有限公司按照《消费品召回管理暂行规定》的要求，主动向广东省市场监督管理局报告了召回计划，将自即日起，召回2019年05月至2020年10月期间制造的部分澳韩品牌多功能转换器插座，型号ZJM-01，涉及数量为1071件。 本次召回范围内的多功能转换器插座，由于产品在电气绝缘、电气间隙、爬电距离和绝缘穿透距离、发热要求以及抗电强度等方面不符合安全标准要求，可能会产生电击触电和引起火灾危险，存在危及人身、财产安全的不合理风险。对于召回范围内的多功能转换器插座，深圳市家中牛电气有限公司将积极落实企业主体责任，开展缺陷产品召回、安全技术改进工作，提升产品安全水平，并免费为客户更换一件全新的符合要求的多功能转换器插座，以消除安全隐患。 深圳市家中牛电气有限公司将自即日起在澳韩天猫旗舰店上发布召回计划，提示持有受影响产品的消费者停止使用该产品并联系深圳市家中牛电气有限公司或其经销商进行免费更换。	黑猫召回	家用电器及电器附件	未知	https://dpac.samr.gov.cn/xfpzh/xfpgnzh/202102/t20210218_96224.html	烧伤,电击伤	2	物理危害	高/低温物质危害,电气危害	高温物质危害,触电危害	空	未知	未知	未知	未知		无	否	无	无	无	无	未知	未知	未知	空	空	空	空	空	否	空	无	无	无	无	空	否	否	否	否	否	否	无	无	无	无	无	无	是	未知	未知	是	未知	未知	未知	未知	无	无	无	否	无	无	无	无	无	无	无	否	否	否	否	是	未知	未知	未知	否	无	无	无	否	否	无	无	无	无	无	无	无	无	无	无	无	无	无	无	无	无	无	无	无	无	无	无	无	无	无	无	无	无	无	无	无	无	无	无	无	无	无	无	无	无	无	无	无	无	无	无	无	无	无	无	无	无	无	无	无	无	无	无	无	无	无	无	无
71	20210218	【江苏】扬州贝克蜜雪玩具礼品有限公司召回毛绒填充玩具（复读鸭）	中国	江苏	毛绒填充玩具（复读鸭）	350	 扬州贝克蜜雪玩具礼品有限公司按照《消费品召回管理暂行规定》的要求，向江苏省市场监督管理局和扬州市市场监督管理局报告了召回计划，将自即日起，召回2020年07月20日至2020年07月29日期间制造的贝克蜜雪牌毛绒填充玩具（复读鸭），涉及数量为350件。 本次召回范围内的毛绒填充玩具（复读鸭），存在以下问题1、在做可预见的合理滥用测试时产生的小零件，有被儿童误食或吸入而引起窒息的危险2、产品缺少必要的警示标识，有被儿童误用（误操作）而导致受伤的风险。对于召回范围内的毛绒填充玩具（复读鸭），扬州贝克蜜雪玩具礼品有限公司将积极落实企业主体责任，开展缺陷产品召回和安全技术改进工作，提升产品安全水平，并联系消费者落实退货、退款事宜，以消除安全隐患。 扬州贝克蜜雪玩具礼品有限公司自2021年02月09日起在淘宝网贝克蜜雪店铺首页（beikemixue.tmall.com）上发布召回计划，提示持有受影响产品的消费者停止使用该产品，并联系扬州贝克蜜雪玩具礼品有限公司或其经销商进行免费退货、退款。消费者可在淘宝网贝克蜜雪店铺首页查看持有的产品是否在受影响范围内，或通过客户服务热线13360521676进一步了解具体情况。	黑猫召回	儿童用品	儿童玩具	https://dpac.samr.gov.cn/xfpzh/xfpgnzh/202102/t20210218_96223.html	窒息	3	物理危害	警示标识缺失	警示标识缺失	空	未知	未知	未知	未知	空	无	否	无	无	无	无	未知	未知	未知	空	空	空	空	空	否	空	无	无	无	无	空	否	否	否	否	否		无	无	无	无	无	无	未知	未知	未知	未知	未知	未知	未知	未知	无	无	无	否	无	无	无	无	无	无	无	否	否	否	否	是	未知	未知	未知	否	无	无	无	否	否	无	无	无	无	无	无	无	无	无	无	无	无	无	无	无	无	无	无	无	无	无	无	无	无	无	无	无	无	无	无	无	无	无	无	无	无	无	无	无	无	无	无	无	无	无	无	无	无	无	无	无	无	无	无	无	无	无	无	无	无	无	无	无
72	20210208	【安徽】南陵县家发镇鑫雅诗电器厂召回部分取暖器	中国	安徽	取暖器	200	南陵县家发镇鑫雅诗电器厂按照《消费品召回管理暂行规定》的要求，主动向安徽省市场监督管理局、芜湖市市场监督管理局报告了召回计划，将自即日起，召回2020年11月20日生产的XYS-FA型号的取暖器，涉及数量为200台。 本次召回范围内的取暖器主要是因为其标志和说明不合格。消费者无法准确了解产品性能，造成错误使用，有可能会导致触电保护失效，消费者存在触电隐患。对于召回范围内的取暖器，南陵县家发镇鑫雅诗电器厂将积极履行企业主体责任，开展缺陷产品召回、安全技术改进工作，提升产品质量，并免费为客户更换的新标签，以消除安全隐患，避免人身健康受到伤害。 南陵县家发镇鑫雅诗电器厂将自即日起发布召回计划，提示持有受影响产品的消费者停止使用该产品并联系南陵县家发镇鑫雅诗电器厂进行免费更换的新标签。	黑猫召回	家用电器及电器附件	未知	https://dpac.samr.gov.cn/xfpzh/xfpgnzh/202102/t20210208_96117.html	电击伤	2	物理危害	电气危害	触电危害	空	未知	未知	未知	未知		无	否	无	无	无	无	未知	未知	未知	空	空	空	空	空	否	空	无	无	无	无	空	否	否	否	否	否	否	无	无	无	无	无	无	未知	未知	未知	是	未知	未知	未知	未知	无	无	无	否	无	无	无	无	无	无	无	否	否	否	否	是	未知	未知	未知	否	无	无	无	否	否	无	无	无	无	无	无	无	无	无	无	无	无	无	无	无	无	无	无	无	无	无	无	无	无	无	无	无	无	无	无	无	无	无	无	无	无	无	无	无	无	无	无	无	无	无	无	无	无	无	无	无	无	无	无	无	无	无	无	无	无	无	无	无
73	20210208	【安徽】南陵县金鹰电器厂召回部分取暖器	中国	安徽	取暖器	25	南陵县金鹰电器厂按照《消费品召回管理暂行规定》的要求，主动向安徽省市场监督管理局、芜湖市市场监督管理局报告了召回计划，将自即日起，召回2019年9月20日生产的JY-A型号的取暖器，涉及数量为25台。 本次召回范围内的取暖器主要是因为其标志和说明、输入功率和电流、结构、接地措施、螺钉和连接不合格。上述情况，使用中有可能会导致触电保护失效，消费者存在触电隐患。对于召回范围内的取暖器，南陵县金鹰电器厂将积极履行企业主体责任，开展缺陷产品召回、安全技术改进工作，提升产品质量，提供退货、换货或退款服务，以除安全隐患，避免人身健康受到伤害。 南陵县金鹰电器厂将自即日起发布召回计划，提示持有受影响产品的消费者停止使用该产品并联系南陵县金鹰电器厂进行免费免费退货、换货或退款服务。	黑猫召回	家用电器及电器附件	未知	https://dpac.samr.gov.cn/xfpzh/xfpgnzh/202102/t20210208_96116.html	电击伤	2	物理危害	电气危害	触电危害	空	未知	未知	未知	未知		无	否	无	无	无	无	未知	未知	未知	空	空	空	空	空	否	空	无	无	无	无	空	否	否	否	否	否	否	无	无	无	无	无	无	未知	未知	未知	是	未知	未知	未知	未知	无	无	无	否	无	无	无	无	无	无	无	否	否	否	否	是	未知	未知	未知	否	无	无	无	否	否	无	无	无	无	无	无	无	无	无	无	无	无	无	无	无	无	无	无	无	无	无	无	无	无	无	无	无	无	无	无	无	无	无	无	无	无	无	无	无	无	无	无	无	无	无	无	无	无	无	无	无	无	无	无	无	无	无	无	无	无	无	无	无
74	20210208	【安徽】芜湖三个太阳电器制造有限公司召回部分取暖器	中国	安徽	取暖器	7	芜湖三个太阳电器制造有限公司按照《消费品召回管理暂行规定》的要求，主动向安徽省市场监督管理局、芜湖市市场监督管理局报告了召回计划，将自即日起，召回2018年4月至5月生产的ST-A型号的取暖器，涉及数量为7台。 本次召回范围内的取暖器主要是因为其标志和说明、输入功率和电流、结构、接地措施、螺钉和连接不合格。上述情况，使用中有可能会导致触电保护失效，消费者存在触电隐患。对于召回范围内的取暖器，芜湖三个太阳电器制造有限公司将积极履行企业主体责任，开展缺陷产品召回、安全技术改进工作，提升产品质量，提供退货、换货或退款服务，以除安全隐患，避免人身健康受到伤害。 芜湖三个太阳电器制造有限公司将自即日起发布召回计划，提示持有受影响产品的消费者停止使用该产品并联系芜湖三个太阳电器制造有限公司进行免费退货、换货或退款服务。	黑猫召回	家用电器及电器附件	未知	https://dpac.samr.gov.cn/xfpzh/xfpgnzh/202102/t20210208_96115.html	电击伤	2	物理危害	电气危害	触电危害	空	未知	未知	未知	未知		无	否	无	无	无	无	未知	未知	未知	空	空	空	空	空	否	空	无	无	无	无	空	否	否	否	否	否	否	无	无	无	无	无	无	未知	未知	未知	是	未知	未知	未知	未知	无	无	无	否	无	无	无	无	无	无	无	否	否	否	否	是	未知	未知	未知	否	无	无	无	否	否	无	无	无	无	无	无	无	无	无	无	无	无	无	无	无	无	无	无	无	无	无	无	无	无	无	无	无	无	无	无	无	无	无	无	无	无	无	无	无	无	无	无	无	无	无	无	无	无	无	无	无	无	无	无	无	无	无	无	无	无	无	无	无
75	20210208	【安徽】芜湖市南陵县开心电器厂召回部分取暖器	中国	安徽	取暖器	43	芜湖市南陵县开心电器厂按照《消费品召回管理暂行规定》的要求，主动向安徽省市场监督管理局、芜湖市市场监督管理局报告了召回计划，将自即日起，召回2019年12月10日生产的KX-B、KX-C型号的取暖器，涉及数量为43台。 本次召回范围内的取暖器主要是因为其标志和说明、输入功率和电流、结构、接地措施、螺钉和连接不合格。上述情况，使用中有可能会导致触电保护失效，消费者存在触电隐患。对于召回范围内的取暖器，芜湖市南陵县开心电器厂将积极履行企业主体责任，开展缺陷产品召回、安全技术改进工作，提升产品质量，提供退货、换货或退款服务，以除安全隐患，避免人身健康受到伤害。 芜湖市南陵县开心电器厂将自即日起发布召回计划，提示持有受影响产品的消费者停止使用该产品并联系芜湖市南陵县开心电器厂进行免费退货、换货或退款服务。	黑猫召回	家用电器及电器附件	未知	https://dpac.samr.gov.cn/xfpzh/xfpgnzh/202102/t20210208_96114.html	电击伤	2	物理危害	电气危害	触电危害	空	未知	未知	未知	未知		无	否	无	无	无	无	未知	未知	未知	空	空	空	空	空	否	空	无	无	无	无	空	否	否	否	否	否	否	无	无	无	无	无	无	未知	未知	未知	是	未知	未知	未知	未知	无	无	无	否	无	无	无	无	无	无	无	否	否	否	否	是	未知	未知	未知	否	无	无	无	否	否	无	无	无	无	无	无	无	无	无	无	无	无	无	无	无	无	无	无	无	无	无	无	无	无	无	无	无	无	无	无	无	无	无	无	无	无	无	无	无	无	无	无	无	无	无	无	无	无	无	无	无	无	无	无	无	无	无	无	无	无	无	无	无
