205	20200331	【江苏】昆山市展邦电器有限公司召回萨尔玛（FEH32）储水式电热水器	中国	江苏	萨尔玛（FEH32）储水式电热水器	3000	 昆山市展邦电器有限公司受缺陷调查影响按照《消费品召回管理暂行规定》的要求，主动向江苏省市场监督管理局报告了召回计划，并自2020年4月2日至2020年7月1日召回2014年4月11日至2019年8月31日期间生产的萨尔玛（FEH32）储水式电热水器，涉及数量为3000台。 本次召回范围内的电热水器，由于其电源线可以推入器具，使内部布线受到应力，导致电源线可能触碰到电热元件而受热，引起绝缘下降或者失效，造成器具外壳带电，存在触电危险。对于召回范围内的电热水器，昆山市展邦电器有限公司将积极落实企业主体责任，开展缺陷产品召回、安全技术改进工作，提升产品安全水平，并免费为客户邮寄塑料孔塞及安装说明，以消除安全隐患。 昆山市展邦电器有限公司将自即日起通过电话、短信或网店客服告知消费者产品召回事宜，并在公司官方网站发布召回信息，提示持有受影响产品的消费者停止使用该产品，并联系昆山市展邦电器有限公司免费获取塑料孔塞及安装说明。	黑猫召回	家用电器及电器附件	未知	https://dpac.samr.gov.cn/xfpzh/xfpgnzh/202003/t20200331_90377.html	电击伤	2	物理危害	电气危害	触电危害	空	未知	未知	未知	未知	空	无	否	无	无	无	无	未知	未知	未知	空	空	空	空	空	否	空	无	无	无	无	空	否	否	否	否	否	否	无	无	无	无	无	无	未知	未知	未知	是	未知	未知	未知	未知	无	无	无	否	无	无	无	无	无	无	无	否	否	否	否	是	未知	未知	未知	否	无	无	无	否	否	无	无	无	无	无	无	无	无	无	无	无	无	无	无	无	无	无	无	无	无	无	无	无	无	无	无	无	无	无	无	无	无	无	无	无	无	无	无	无	无	无	无	无	无	无	无	无	无	无	无	无	无	无	无	无	无	无	无	无	无	无	无	无
206	20200327	【福建】福州弘晟联创电器有限公司召回部分灭蚊灯	中国	福建	灭蚊灯	4000	  福州弘晟联创电器有限公司按照《消费品召回管理暂行规定》的要求，向福建省市场监督管理局备案召回计划，决定召回部分2018年3月1日-2018年6月1日生产的LED光触媒灭蚊灯。本次召回产品型号为T-306，生产批号为201803。据该公司统计，涉及召回的产品数量共4000台。 本次召回范围内的灭蚊灯，由于对触及带电部件的防护、工作温度下的泄漏电流和电气强度、电源连接和外部软线项目不符合国家标准要求，使用过程中存在电流泄露造成触电的风险，具有一定的安全隐患。对于召回范围内的灭蚊灯，福州弘晟联创电器有限公司将积极落实企业主体责任，开展缺陷产品召回、安全技术改进工作，提升产品质量安全水平，并为消费者提供退换货服务，以消除安全隐患。 福州弘晟联创电器有限公司将自即日起在经销商门店发布召回计划，提示持有受影响产品的消费者停止使用该产品并联系福州弘晟联创电器有限公司进行退换货。	黑猫召回	家用电器及电器附件	未知	https://dpac.samr.gov.cn/xfpzh/xfpgnzh/202003/t20200327_90192.html	电击伤	2	物理危害	电气危害	触电危害	空	未知	未知	未知	未知		无	否	无	无	无	无	未知	未知	未知	空	空	空	空	空	否	空	无	无	无	无	空	否	否	否	否	否	否	无	无	无	无	无	无	未知	未知	未知	是	未知	未知	未知	未知	无	无	无	否	无	无	无	无	无	无	无	否	否	否	否	是	未知	未知	未知	否	无	无	无	否	否	无	无	无	无	无	无	无	无	无	无	无	无	无	无	无	无	无	无	无	无	无	无	无	无	无	无	无	无	无	无	无	无	无	无	无	无	无	无	无	无	无	无	无	无	无	无	无	无	无	无	无	无	无	无	无	无	无	无	无	无	无	无	无
207	20200327	【福建】艾笛森（厦门）光电科技有限公司召回部分吸顶灯产品	中国	福建	吸顶灯	408	  艾笛森（厦门）光电科技有限公司按照《消费品召回管理暂行规定》的要求，向福建省市场监督管理局备案召回计划，决定召回部分2016年9月28日至2018年1月25日期间生产的LED吸顶灯，涉及型号为D1499 220-240V 50HZ 12W。据该公司统计，涉及召回的产品数量共408个。 本次召回范围内的产品主要是因为外部接线与内部接线项目不符合国家标准要求。由于产品导线没有固定装置，极端情况下导线可能会被扯出，导致触电的情况发生。对于召回范围内的LED吸顶灯，艾笛森（厦门）光电科技有限公司将积极落实企业主体责任，开展缺陷产品召回、安全技术改进工作，提升产品质量安全水平，并为消费者提供修理服务，以消除安全隐患。 艾笛森（厦门）光电科技有限公司将自即日起在网站发布召回计划，提示持有受影响产品的消费者停止使用该产品并联系艾笛森（厦门）光电科技有限公司进行修理。用户可通过网站（http//www.edixeon.com/）公告查看持有的LED吸顶灯产品是否为受影响的产品，或通过客户服务热线（0595-5933915）进一步了解具体情况。用户也可登陆福建省市场监督管理局（http//zjj.fujian..cn/）网站了解更多信息。 （转自福建省市场监督管理局网站） 	黑猫召回	家具及建筑装饰装修材料	未知	https://dpac.samr.gov.cn/xfpzh/xfpgnzh/202003/t20200327_90190.html	电击伤	2	物理危害	电气危害	触电危害	空	未知	未知	未知	未知		无	否	无	无	无	无	未知	未知	未知	空	空	空	空	空	否	空	无	无	无	无	空	否	否	否	否	否	否	无	无	无	无	无	无	未知	未知	未知	是	未知	未知	未知	未知	无	无	无	否	无	无	无	无	无	无	无	否	否	否	否	是	未知	未知	未知	否	无	无	无	否	否	无	无	无	无	无	无	无	无	无	无	无	无	无	无	无	无	无	无	无	无	无	无	无	无	无	无	无	无	无	无	无	无	无	无	无	无	无	无	无	无	无	无	无	无	无	无	无	无	无	无	无	无	无	无	无	无	无	无	无	无	无	无	无
208	20200323	【江苏】无锡市国英新能源科技有限公司召回炽锋牌（PY-X7）移动电源	中国	江苏	移动电源	3	 无锡市国英新能源科技有限公司向江苏省市场监督管理局备案了召回计划，决定自2020年03月23日至2020年9月30日召回2018年8月19日至2018年12月1日期间生产的炽锋牌（PY-X7）移动电源，受影响的产品数量为3件。 本次召回所涉及的移动电源，产品外壳的防火性能未达到要求，当产品内部发生短路或者其他原因出现燃烧时，在极端情况下可能产生火灾，存在安全隐患。 无锡市国英新能源科技有限公司将在淘宝店铺上发布召回公告，并通过淘宝客服、电话、短信等方式告知消费者产品召回事宜。敬请消费者立即停止使用召回范围内的产品，并与淘宝客服或直接与无锡市国英新能源科技有限公司联系凭购买记录登记退款。消费者因本次召回产生的相关费用均由无锡市国英新能源科技有限公司承担。 	黑猫召回	家用电器及电器附件	未知	https://dpac.samr.gov.cn/xfpzh/xfpgnzh/202003/t20200323_90119.html	烧伤,电击伤	2	物理危害	高/低温物质危害,电气危害	高温物质危害,触电危害	空	未知	未知	未知	未知	空	无	否	无	无	无	无	未知	未知	未知	空	空	空	空	空	否	空	无	无	无	无	空	否	否	否	否	否	否	无	无	无	无	无	无	是	未知	未知	未知	是	未知	未知	未知	无	无	无	否	无	无	无	无	无	无	无	否	否	否	否	是	未知	未知	未知	否	无	无	无	否	否	无	无	无	无	无	无	无	无	无	无	无	无	无	无	无	无	无	无	无	无	无	无	无	无	无	无	无	无	无	无	无	无	无	无	无	无	无	无	无	无	无	无	无	无	无	无	无	无	无	无	无	无	无	无	无	无	无	无	无	无	无	无	无
209	20200319	嘉陵-本田发动机有限公司召回EU22iT发电机	中国	不详	EU22iT发电机	696	  嘉陵-本田发动机有限公司按照《消费品召回管理暂行规定》的要求，主动向国家市场监督管理总局报告了召回计划，将自即日起，召回2018年7月20日至2020年1月7日期间销售的本田牌EU22iT型号发电机，涉及数量为696件。 本次召回范围内的发电机，在雨水环境使用时发电机的变频器AC输出接头有可能发生短路，存在变频器和接头损坏或者外盖燃烧的安全隐患。对于召回范围内的发电机，嘉陵-本田发动机有限公司将积极落实企业主体责任，开展缺陷产品召回、安全技术改进工作，提升产品安全水平，对变频器进行改善，免费为客户检查维修或者更换变频器，以消除安全隐患。 嘉陵-本田发动机有限公司将自即日起在官方网站（www.jlhonda.com）上发布召回计划，提示持有受影响产品的消费者在雨水环境中严禁使用该产品或联系嘉陵-本田发动机有限公司或其经销商进行免费检查维修或者更换。	黑猫召回	家用电器及电器附件	未知	https://dpac.samr.gov.cn/xfpzh/xfpgnzh/202003/t20200319_90016.html	电击伤	2	物理危害	高/低温物质危害,电气危害	高温物质危害,触电危害	空	未知	未知	未知	发动机		无	否	无	无	无	无	未知	未知	未知	空	空	空	空	空	否	空	无	无	无	无	空	否	否	否	否	否	否	无	无	无	无	无	无	是	未知	未知	未知	是	未知	未知	未知	无	无	无	否	无	无	无	无	无	无	无	否	否	否	否	是	未知	未知	未知	否	无	无	无	否	否	无	无	无	无	无	无	无	无	无	无	无	无	无	无	无	无	无	无	无	无	无	无	无	无	无	无	无	无	无	无	无	无	无	无	无	无	无	无	无	无	无	无	无	无	无	无	无	无	无	无	无	无	无	无	无	无	无	无	无	无	无	无	无
210	20200319	【江苏】南京汉德森科技股份有限公司召回汉德森牌（5W）LED TABLE LAMP台灯	中国	江苏	汉德森牌（5W）LED TABLE LAMP台灯	364	南京汉德森科技股份有限公司向江苏省市场监督管理局备案了召回计划，决定自2020年3月19日至2020年6月19日召回2018年1月15日至2018年8月15日期间生产的汉德森牌（5W）LED TABLE LAMP台灯，受影响的产品数量为364只。 本次召回所涉及的LED TABLE LAMP台灯存在以下问题1、未标记产品型号、未标记Ⅲ类灯具符号，可能导致消费者触电2、灯具以最不利位置置于水平面时，灯具倾倒，可能引起不可预见的伤害。 南京汉德森科技股份有限公司将通过天猫店铺发布召回公告，并通过天猫客服或电话、短信等方式告知消费者产品召回事宜。敬请消费者立即停止使用召回范围内的产品，并与天猫客服或直接与南京汉德森科技股份有限公司联系进行退货或换货。消费者因本次召回产生的相关费用均由南京汉德森科技股份有限公司承担。 	黑猫召回	家用电器及电器附件	未知	https://dpac.samr.gov.cn/xfpzh/xfpgnzh/202003/t20200319_90007.html	电击伤,其他	2	物理危害	电气危害	触电危害	空	未知	未知	未知	未知		无	否	无	无	无	无	未知	未知	未知	空	空	空	空	空	否	空	无	无	无	无	空	否	否	否	否	否	否	无	无	无	无	无	无	未知	未知	未知	是	未知	未知	未知	未知	无	无	无	否	无	无	无	无	无	无	无	否	否	否	否	是	未知	未知	未知	否	无	无	无	否	否	无	无	无	无	无	无	无	无	无	无	无	无	无	无	无	无	无	无	无	无	无	无	无	无	无	无	无	无	无	无	无	无	无	无	无	无	无	无	无	无	无	无	无	无	无	无	无	无	无	无	无	无	无	无	无	无	无	无	无	无	无	无	无
211	20200410	【上海】上海申花电器企业发展有限公司召回部分申花牌家用燃气快速热水器	中国	河南	申花牌家用燃气快速热水器	5	  上海申花电器企业发展有限公司按照《消费品召回管理暂行规定》的要求,向上海市市场监督管理局报告了召回计划，将自即日起，召回2019年1月20日生产的申花牌JSQ24-ML家用燃气快速热水器，涉及数量为5台。 本次召回范围内的家用燃气快速热水器，型号为JSQ24-ML，由于产品检测的烟气中CO含量（无风状态）项目不符合GB 20665-2015《家用燃气快速热水器和燃气采暖热水炉能效限定值及能效等级》、GB 6932-2015《家用燃气快速热水器》的要求，燃烧后产生的CO废气含量超出限定值，如果废气不能及时排出会造成室内人员一氧化碳中毒的危险。 上海申花电器企业发展有限公司自即日将召回计划发布在玲志建材经营部、申花售后部、河南中路200号申花专卖店等。提示持有受影响产品的消费者停止使用该产品，并联系上海申花电器企业发展有限公司进行免费更换或退货。公众号（SAMRDPAC）以及拨打热线电话010-59799616反映召回活动实施过程中的问题或提交缺陷线索。 	黑猫召回	家用电器及电器附件	未知	https://dpac.samr.gov.cn/xfpzh/xfpgnzh/202004/t20200410_90554.html	全身中毒	4	物理危害	高/低温物质危害	高温物质危害	空	未知	未知	未知	未知		无	否	无	无	无	无	未知	未知	未知	空	空	空	空	空	否	空	无	无	无	无	空	否	否	否	否	否	否	无	无	无	无	无	无	是	未知	未知	未知	未知	未知	未知	未知	无	无	无	否	无	无	无	无	无	无	无	否	否	否	否	是	未知	未知	未知	否	无	无	无	否	否	无	无	无	无	无	无	无	无	无	无	无	无	无	无	无	无	无	有	无	无	无	无	无	无	无	无	无	无	无	无	无	无	无	无	无	无	无	无	无	无	无	无	无	无	无	无	无	无	无	无	无	无	无	无	无	无	无	无	无	无	无	无	无
212	20200305	【安徽】天长市恒久电子厂召回部分电动车充电器	中国	安徽	充电器	8000	天长市恒久电子厂受缺陷调查影响，按照《消费品召回管理暂行规定》的要求，主动向安徽省市场监督管理局报告了扩大召回计划，将自即日起，召回2019年5月至2019年6月期间制造的部分恒久48V20AH充电器，涉及数量为8000只。 本次召回范围内电动车充电器，由于在生产过程中使用了机械强度不足的外壳，可能存在外壳破损造成漏电的安全隐患。对于召回范围内的电动车充电器，天长市恒久电子厂将积极落实企业主体责任，开展缺陷产品召回、安全技术改进工作，提升产品安全水平，并免费为客户更换一只全新的符合要求的充电器，以消除安全隐患。 天长市恒久电子厂将自即日起在官方网站（www.ahhjdz.com）上发布召回计划，提示持有受影响产品的消费者停止使用该产品并联系天长市恒久电子厂或其经销商进行免费更换。	黑猫召回	家用电器及电器附件	未知	https://dpac.samr.gov.cn/xfpzh/xfpgnzh/202003/t20200305_89740.html	电击伤	2	物理危害	电气危害	触电危害	空	未知	未知	未知	未知	空	无	否	无	无	无	无	未知	未知	未知	空	空	空	空	空	否	空	无	无	无	无	空	否	否	否	否	否	否	无	无	无	无	无	无	未知	未知	未知	是	未知	未知	未知	未知	无	无	无	否	无	无	无	无	无	无	无	否	否	否	否	是	未知	未知	未知	否	无	无	无	否	否	无	无	无	无	无	无	无	无	无	无	无	无	无	无	无	无	无	无	无	无	无	无	无	无	无	无	无	无	无	无	无	无	无	无	无	无	无	无	无	无	无	无	无	无	无	无	无	无	无	无	无	无	无	无	无	无	无	无	无	无	无	无	无
213	20200305	【安徽】天长市同富电子科技有限公司召回部分众华蕊品牌充电器	中国	安徽	充电器	10500	天长市同富电子科技有限公司按照《消费品召回管理暂行规定》的要求，主动向安徽省市场监督管理局报告了召回计划，将自即日起，召回2019年4月24日期间制造的部分众华蕊懒人充48V20充电器，涉及数量为10500只。 本次召回范围内的众华蕊懒人充48V20充电器，由于在生产过程中外壳机械强度不达标，可能存在漏电的安全隐患。对于召回范围内的众华蕊懒人充48V20充电器，天长市同富电子科技有限公司将积极落实企业主体责任，开展缺陷产品召回、安全技术改进工作，提升产品安全水平，并免费为客户更换一件全新的符合要求的众华蕊懒人充48V20充电器以消除安全隐患。 天长市同富电子科技有限公司将自即日起发布召回计划，提示持有受影响产品的消费者停止使用该产品并联系天长市同富电子科技有限公司或其经销商进行免费更换。公众号（SAMRDPAC）以及拨打热线电话010-59799616反映召回活动实施过程中的问题或提交缺陷线索。 	黑猫召回	家用电器及电器附件	未知	https://dpac.samr.gov.cn/xfpzh/xfpgnzh/202003/t20200305_89738.html	电击伤	2	物理危害	电气危害	触电危害	空	未知	未知	未知	未知	空	无	否	无	无	无	无	未知	未知	未知	空	空	空	空	空	否	空	无	无	无	无	空	否	否	否	否	否	否	无	无	无	无	无	无	未知	未知	未知	是	未知	未知	未知	未知	无	无	无	否	无	无	无	无	无	无	无	否	否	否	否	是	未知	未知	未知	否	无	无	无	否	否	无	无	无	无	无	无	无	无	无	无	无	无	无	无	无	无	无	无	无	无	无	无	无	无	无	无	无	无	无	无	无	无	无	无	无	无	无	无	无	无	无	无	无	无	无	无	无	无	无	无	无	无	无	无	无	无	无	无	无	无	无	无	无
214	20200305	【安徽】天长市鑫鹏电子厂召回部分电动车充电器	中国	安徽	充电器	10060	天长市鑫鹏电子厂按照《消费品召回管理暂行规定》的要求，主动向安徽省市场监督管理局报告了召回计划，将自即日起，召回2019年5月至2019年6月期间制造的部分鑫鹏48V12AH充电器，涉及数量为10060只。 本次召回范围内电动车充电器，由于在生产过程中使用了机械强度不足的外壳，可能存在外壳破损造成漏电的安全隐患。对于召回范围内的电动车充电器，天长市鑫鹏电子厂将积极落实企业主体责任，开展缺陷产品召回、安全技术改进工作，提升产品安全水平，并免费为客户更换一只全新的符合要求的充电器，以消除安全隐患。 天长市鑫鹏电子厂将自即日起在官方网站（www.ahhjdz.com）上发布召回计划，提示持有受影响产品的消费者停止使用该产品并联系天长市鑫鹏电子厂或其经销商进行免费更换。	黑猫召回	家用电器及电器附件	未知	https://dpac.samr.gov.cn/xfpzh/xfpgnzh/202003/t20200305_89739.html	电击伤	2	物理危害	电气危害	触电危害	空	未知	未知	未知	未知	空	无	否	无	无	无	无	未知	未知	未知	空	空	空	空	空	否	空	无	无	无	无	空	否	否	否	否	否	否	无	无	无	无	无	无	未知	未知	未知	是	未知	未知	未知	未知	无	无	无	否	无	无	无	无	无	无	无	否	否	否	否	是	未知	未知	未知	否	无	无	无	否	否	无	无	无	无	无	无	无	无	无	无	无	无	无	无	无	无	无	无	无	无	无	无	无	无	无	无	无	无	无	无	无	无	无	无	无	无	无	无	无	无	无	无	无	无	无	无	无	无	无	无	无	无	无	无	无	无	无	无	无	无	无	无	无
215	20200305	【安徽】天长市天玛电子有限责任公司召回部分马上行品牌充电器	中国	安徽	充电器	10000	天长市天玛电子有限责任公司按照《消费品召回管理暂行规定》的要求，主动向安徽省市场监督管理局报告了召回计划，将自即日起，召回2019年5月至2019年6月期间制造的部分马上行牌48V20Ah充电器，涉及数量为10000只。 本次召回范围内的马上行牌48V20Ah充电器，由于在生产过程中外壳机械强度不达标，可能存在漏电的安全隐患。对于召回范围内的马上行牌48V20Ah充电器，天长市天玛电子有限责任公司将积极落实企业主体责任，开展缺陷产品召回、安全技术改进工作，提升产品安全水平，并免费为客户更换一件全新的符合要求的马上行牌48V20Ah充电器以消除安全隐患。 天长市天玛电子有限责任公司将自即日起通过手机发布召回计划，提示持有受影响产品的消费者停止使用该产品并跟销商进行免费更换。	黑猫召回	家用电器及电器附件	未知	https://dpac.samr.gov.cn/xfpzh/xfpgnzh/202003/t20200305_89737.html	电击伤	2	物理危害	电气危害	触电危害	空	未知	未知	未知	未知	空	无	否	无	无	无	无	未知	未知	未知	空	空	空	空	空	否	空	无	无	无	无	空	否	否	否	否	否	否	无	无	无	无	无	无	未知	未知	未知	是	未知	未知	未知	未知	无	无	无	否	无	无	无	无	无	无	无	否	否	否	否	是	未知	未知	未知	否	无	无	无	否	否	无	无	无	无	无	无	无	无	无	无	无	无	无	无	无	无	无	无	无	无	无	无	无	无	无	无	无	无	无	无	无	无	无	无	无	无	无	无	无	无	无	无	无	无	无	无	无	无	无	无	无	无	无	无	无	无	无	无	无	无	无	无	无
216	20200305	【安徽】天长市时来电子科技有限公司召回部分荣炳派正富品牌充电器	中国	安徽	充电器	10200	天长市时来电子科技有限公司按照《消费品召回管理暂行规定》的要求，主动向安徽省市场监督管理局报告了召回计划，将自即日起，召回2019年4月至2019年5月期间制造的部分荣炳派正富牌48V20Ah充电器，涉及数量为10200只。 本次召回范围内的荣炳派正富牌48V20Ah充电器，由于在生产过程中外壳机械强度不达标，可能存在漏电的安全隐患。对于召回范围内的荣炳派正富牌48V20Ah充电器，天长市时来电子科技有限公司将积极落实企业主体责任，开展缺陷产品召回、安全技术改进工作，提升产品安全水平，并免费为客户更换一件全新的符合要求的荣炳派正富牌48V20Ah充电器以消除安全隐患。 天长市时来电子科技有限公司将自即日起在官方网站（www.shilaidq.com）上发布召回计划，提示持有受影响产品的消费者停止使用该产品并联系天长市时来电子科技有限公司或其经销商进行免费更换。	黑猫召回	家用电器及电器附件	未知	https://dpac.samr.gov.cn/xfpzh/xfpgnzh/202003/t20200305_89735.html	电击伤	2	物理危害	电气危害	触电危害	空	未知	未知	未知	未知	空	无	否	无	无	无	无	未知	未知	未知	空	空	空	空	空	否	空	无	无	无	无	空	否	否	否	否	否	否	无	无	无	无	无	无	未知	未知	未知	是	未知	未知	未知	未知	无	无	无	否	无	无	无	无	无	无	无	否	否	否	否	是	未知	未知	未知	否	无	无	无	否	否	无	无	无	无	无	无	无	无	无	无	无	无	无	无	无	无	无	无	无	无	无	无	无	无	无	无	无	无	无	无	无	无	无	无	无	无	无	无	无	无	无	无	无	无	无	无	无	无	无	无	无	无	无	无	无	无	无	无	无	无	无	无	无
217	20200305	【安徽】天长市森林电器科技有限公司召回部分森林荣耀品牌充电器	中国	安徽	充电器	15000	天长市森林电器科技有限公司按照《消费品召回管理暂行规定》的要求，主动向安徽省市场监督管理局报告了召回计划，将自即日起，召回2019年5月至2019年7月期间制造的部分森林荣耀牌48V20充电器，涉及数量为15000只。 本次召回范围内的森林荣耀牌48V20充电器，由于在生产过程中外壳机械强度不达标，可能存在漏电的安全隐患。对于召回范围内的森林荣耀牌48V20充电器，天长市森林电器科技有限公司将积极落实企业主体责任，开展缺陷产品召回、安全技术改进工作，提升产品安全水平，并免费为客户更换一件全新的符合要求的森林荣耀牌48V20充电器以消除安全隐患。 天长市森林电器科技有限公司将自即日起在官方网站（www.senlindianqi.com）上发布召回计划，提示持有受影响产品的消费者停止使用该产品并联系天长市森林电器科技有限公司或其经销商进行免费更换。	黑猫召回	家用电器及电器附件	未知	https://dpac.samr.gov.cn/xfpzh/xfpgnzh/202003/t20200305_89734.html	电击伤	2	物理危害	电气危害	触电危害	空	未知	未知	未知	未知	空	无	否	无	无	无	无	未知	未知	未知	空	空	空	空	空	否	空	无	无	无	无	空	否	否	否	否	否	否	无	无	无	无	无	无	未知	未知	未知	是	未知	未知	未知	未知	无	无	无	否	无	无	无	无	无	无	无	否	否	否	否	是	未知	未知	未知	否	无	无	无	否	否	无	无	无	无	无	无	无	无	无	无	无	无	无	无	无	无	无	无	无	无	无	无	无	无	无	无	无	无	无	无	无	无	无	无	无	无	无	无	无	无	无	无	无	无	无	无	无	无	无	无	无	无	无	无	无	无	无	无	无	无	无	无	无
